,工种_pred,自我介绍,工种_true
82,弱电/消防/水暖/开槽/通风 || 普工 || 空调/管道/通风/管网 || 钢结构/打板/不锈钢/抗震支架 || 水电工/电工 || 焊工/铆工/钣金/钳工 || 包装工 || 小工/杂工/拆除工/打磨/学徒 || 电工 || 亮化/市政照明 || 学徒工 || 焊工,浩雨水电突击帮工团队电话:前期预埋有30人（有焊工，自带焊机），后期有80人， 小工30人，（工具自带）（百人团队）承接范围:（郑州以及附近周边）承接内容:现主要承接前期预埋，后期二次配管，疏通排堵，后期穿线装灯穿引线，配盘芯，做桥架，压电缆，，上下水，给排水， 压力排水，消防水，等一切水电活。郑重承诺！ 人员年轻，服从管理！价格合理，质量可靠。（可包可点）（付款方式可谈）欢迎致电咨询:电话微信同号 老板们请存留电话，加个微信，（以备急用）（如有打扰，敬请谅解）团队承诺：2小时内如发现哪个工人干活不行，直接撵走，分文不取。,-- || 水电工/电工 || 焊工
83,弱电/消防/水暖/开槽/通风 || 塔吊/吊车司机/信号工/维修 || 空调/管道/通风/管网 || 钢结构/打板/不锈钢/抗震支架 || 水电工/电工 || 挖机/钩机/维修 || 吊篮安拆工/维修工 || 焊工/铆工/钣金/钳工 || 小工/杂工/拆除工/打磨/学徒 || 电工 || 亮化/市政照明 || 电梯/升降机司机/安装/维修 || 焊工,恒利水电帮工团队承接范围：郑州，新密，荥阳，上街，中牟，港区，新郑，周边地区现有人员前期加后期80人左右。工作内容: 前期预埋{有焊工}。旧楼改造。二次配管。疏通排堵。维修。穿线。装灯。穿引线。装面板。桥架，压箱心。地库装电棒。压力排水。放电缆。压电缆头。等一切消防水电活。人员年轻。服从管理。价格合理。质量可靠。一次合作终身朋友，需要帮忙的老板，请提前一天联系。手机号码微信同号【请加微信以后备用欢迎致电：团队承诺：2小时内如发现哪个工人干活不行，直接撵走，分文不取,-- || -- || 水电工/电工
84,瓦工/砌砖 || 泥工/抹灰,本人专业内墙抹灰长期在碧桂园干有需要的老板可以联系我限广西微信同号,-- || -- || 瓦工/泥工/抹灰/砌砖/贴砖/美缝
85,瓦工/砌砖,找珠三角套房工区墙地砖活 周,-- || -- || 瓦工/泥工/抹灰/砌砖/贴砖/美缝
86,,二次结构木工找活，6个人随时可以进场，行程码不带星号。陈师傅。此信息长期有效。请说在建筑用工平台看见的。,-- || -- || 建筑木工/铝模/拆模/二次结构
87,桥梁 || 混凝土/打爆模/拉毛挂网 || 隧道/涵洞 || 架子工/爬架/拆架,现有4人找内外墙拉毛挂网可以马上进场开工有需要的老板请来电微信同号方量越大越好,-- || 混凝土/打爆模/拉毛挂网 || 外墙/吊篮/保温/高空作业
88,瓦工/砌砖 || 搬运工,专业上材料，ALC格墙板，泡沫砖，地板砖，拉成品砂浆，内外墙，有介绍量大给三仟红包，只做包工，自带工具地方不限要求量大，随时可以进，如有需要的老板联系:杨,-- || -- || 外墙/吊篮/保温/高空作业
89,普工 || 搬运工 || 包装工 || 小工/杂工/拆除工/打磨/学徒 || 瓦工/砌砖 || 学徒工,小工找活，专业上材料，ALC格墙板，泡沫砖，地板砖，拉成品砂浆，内外墙，只做包工，自带工具地方不限要求量大，随时可以进，如有需要的老板联系杨,-- || -- || 小工/杂工/拆除工/打磨/学徒
90,桥梁 || 隧道/涵洞 || 架子工/爬架/拆架,哪个老板需要用架子工人的提前联系，我人员年轻干活安全，搭架子，保质量，单价靠谱，欢迎各位老总，老板的来电一起合作永久朋友，包工点工都可以，合作愉快，共同发财，人在郑州找活,-- || -- || 架子工/爬架/拆架
91,电工 || 塔吊/吊车司机/信号工/维修 || 钢结构/打板/不锈钢/抗震支架 || 水电工/电工 || 挖机/钩机/维修 || 吊篮安拆工/维修工 || 焊工/铆工/钣金/钳工 || 弱电/消防/水暖/开槽/通风 || 亮化/市政照明 || 电梯/升降机司机/安装/维修 || 焊工,电工团队找活，强弱电，上下水，焊工，有证，做管，穿线，桥架，线路维修，灯具安装，电箱，配电柜，经验丰富，工作认真，需要人的联系，    北京,-- || 焊工 || 弱电/消防/水暖/开槽/通风
92,亮化/市政照明 || 水电工/电工 || 电工,电工找活，在大兴住，有电工证，做管穿线，装灯，都可以。有需要人的老板请联系,-- || -- || 水电工/电工
93,亮化/市政照明 || 水电工/电工 || 电工,"电工一人到多人找活，安装穿线配管都可以，工装家装都行 
  北京",-- || -- || 水电工/电工
94,,明天还有6个木工，找活  石家庄,-- || -- || 建筑木工/铝模/拆模/二次结构
95,,找活：专业切空鼓团队，借贵平台找切空鼓的活，自带工具，最好是包工，广东省内都可以，人在惠州陈江，有需要的老板来电大量从优，微信同步,-- || -- || 瓦工/泥工/抹灰/砌砖/贴砖/美缝
96,桥梁 || 隧道/涵洞 || 架子工/爬架/拆架,明天没雨明了，天找活，我有五个内外架师傅，有需要帮忙的联系方式。 福建架子工,-- || -- || 架子工/爬架/拆架
97,,本团队现有10个木工包工人员找活；寻找大面积车库及厂房；限山东，河北范围及区县；需要木工包工人员的老总欢迎来电合作：联系电话：,-- || -- || 建筑木工/铝模/拆模/二次结构
98,焊工/铆工/钣金/钳工 || 焊工 || 钢结构/打板/不锈钢/抗震支架,下午找活，电焊二保氩弧焊  天津滨海,-- || -- || 焊工
99,焊工/铆工/钣金/钳工 || 焊工 || 钢结构/打板/不锈钢/抗震支架,电焊工找活儿 山东济南,-- || -- || 焊工
100,空调/管道/通风/管网 || 水电工/电工,水工找活，人在北京，电话,-- || -- || 水电工/电工
101,亮化/市政照明 || 水电工/电工 || 电工,电工找活，人在大兴天宫院住电话,-- || -- || 水电工/电工
102,桥梁 || 隧道/涵洞 || 建筑木工/铝模/拆模/二次结构,找活，找活？山东境内 专业拆木模，模壳，高低楼都可以，，拆内架，人年轻能干，价格合理，可包可点，要求钱快，欢迎各位老板来电：田,-- || -- || 建筑木工/铝模/拆模/二次结构
103,焊工/铆工/钣金/钳工 || 焊工 || 钢结构/打板/不锈钢/抗震支架,焊工2人找活~有证~人在昌平区小汤山，用人老板联系：,-- || -- || 焊工
104,包装工 || 普工 || 小工/杂工/拆除工/打磨/学徒 || 学徒工,有一到五人小工找活年轻力壮 山东菏泽,-- || -- || 小工/杂工/拆除工/打磨/学徒
105,桥梁 || 隧道/涵洞 || 架子工/爬架/拆架,明天还有14个爬架工，住工地都可以需要的老板联系,-- || -- || 架子工/爬架/拆架
106,包装工 || 普工 || 小工/杂工/拆除工/打磨/学徒 || 学徒工,找活，明天龙湖岀发一个小工带辆七座车，有需要的请联系,-- || -- || 架子工/爬架/拆架
